{
  "version": "m6.6-v1",
  "id": "synthetic-format-demo",
  "title": "格式演示，非 DFT / Format demo, NOT DFT",
  "kind": "synthetic-test",
  "units": {
    "energy": "eV-total",
    "forces": "eV/angstrom",
    "positions": "angstrom"
  },
  "source": {
    "citation": "MaterialsX team-generated geometry and synthetic zero labels; NOT DFT",
    "license": "AGPL-3.0-only",
    "licenseConfirmed": true,
    "labelProvenanceSha256": "aaaaaaaaaaaaaaaaaaaaaaaaaaaaaaaaaaaaaaaaaaaaaaaaaaaaaaaaaaaaaaaa"
  },
  "settings": {
    "code": "NOT DFT: format demo",
    "version": "demo",
    "functional": "PBE+U",
    "hubbardU": {},
    "pseudopotentialSha256": [
      "aaaaaaaaaaaaaaaaaaaaaaaaaaaaaaaaaaaaaaaaaaaaaaaaaaaaaaaaaaaaaaaa"
    ],
    "cutoffEv": 500,
    "kpointMesh": [
      4,
      4,
      4
    ],
    "spin": "synthetic",
    "charge": "synthetic",
    "energyReference": "synthetic zero; not a physical reference",
    "corrections": "not applicable",
    "forceConvergenceEvPerAngstrom": 0.01,
    "electronicConvergenceEv": 1e-06
  },
  "audits": [
    {
      "potentialId": "chgnet-0.3.0",
      "trainingOverlap": "unknown",
      "reviewer": "format demo, not reviewed",
      "evidenceSha256": "aaaaaaaaaaaaaaaaaaaaaaaaaaaaaaaaaaaaaaaaaaaaaaaaaaaaaaaaaaaaaaaa",
      "reviewedAt": "2026-10-02",
      "matchedTheory": false,
      "matchedEnergyReference": false
    }
  ],
  "samples": [
    {
      "id": "si-demo",
      "domain": "bulk",
      "structure": {
        "schemaVersion": "m6.0-v1",
        "id": "si-diamond",
        "coordinateUnit": "angstrom",
        "atoms": [
          {
            "id": "a1",
            "element": "Si",
            "position": [
              0.0,
              0.0,
              0.0
            ],
            "occupancy": 1
          },
          {
            "id": "a2",
            "element": "Si",
            "position": [
              0.0,
              2.715,
              2.715
            ],
            "occupancy": 1
          },
          {
            "id": "a3",
            "element": "Si",
            "position": [
              2.715,
              0.0,
              2.715
            ],
            "occupancy": 1
          },
          {
            "id": "a4",
            "element": "Si",
            "position": [
              2.715,
              2.715,
              0.0
            ],
            "occupancy": 1
          },
          {
            "id": "a5",
            "element": "Si",
            "position": [
              1.3575,
              1.3575,
              1.3575
            ],
            "occupancy": 1
          },
          {
            "id": "a6",
            "element": "Si",
            "position": [
              1.3575,
              4.0725,
              4.0725
            ],
            "occupancy": 1
          },
          {
            "id": "a7",
            "element": "Si",
            "position": [
              4.0725,
              1.3575,
              4.0725
            ],
            "occupancy": 1
          },
          {
            "id": "a8",
            "element": "Si",
            "position": [
              4.0725,
              4.0725,
              1.3575
            ],
            "occupancy": 1
          }
        ],
        "cell": [
          [
            5.43,
            0,
            0
          ],
          [
            0,
            5.43,
            0
          ],
          [
            0,
            0,
            5.43
          ]
        ],
        "pbc": [
          true,
          true,
          true
        ],
        "charge": null,
        "spinMultiplicity": null,
        "source": {
          "artifactId": "sample-si-diamond",
          "sha256": "6e5be3cfe63c70a5567592d4ae6e207d5213ac57625faf864b57261bcce96812",
          "format": "poscar",
          "provenance": "team-synthetic",
          "license": "AGPL-3.0-only",
          "transformations": []
        },
        "issues": []
      },
      "energyEv": 0,
      "forcesEvPerAngstrom": [
        [
          0,
          0,
          0
        ],
        [
          0,
          0,
          0
        ],
        [
          0,
          0,
          0
        ],
        [
          0,
          0,
          0
        ],
        [
          0,
          0,
          0
        ],
        [
          0,
          0,
          0
        ],
        [
          0,
          0,
          0
        ],
        [
          0,
          0,
          0
        ]
      ]
    }
  ]
}
